d_talbott_4.txt,"After a recent stay at the Talbott Hotel in Chicago, I left the city with an empty pocket book. I had booked a package deal online and although the service was absolutely terrific, i didn't realize some of the amenities i was paying for included personalized key cards and room service menus. I could have done with out my room key having my name printed across it as well as the menu. When did my name printed on things become an extra amenity that cost so much money? I basically felt overcharged for the so called 'extras' included in the package i purchased. One other thing, the traffic was pretty horrible and checking in seems like it could have somehow been made simpler."
d_talbott_5.txt,"My husband and I were planning our 1st year wedding anniversary and we wanted to go back and spend it in Chicago where we had first met. After spending several minutes frustratingly navigating The Talbott Hotel's website, I FINALLY was able to complete a reservation for a long weekend. After a long flight into Chicago, we were so ready to check in, shower, and lay down in our hotel room. However, once we arrived the unfriendly clerk behind the counter notified us that we did not have a reservation. I provided her with the confirmation email and she again said there must be a mistake because the room we reserved was already occupied. She begrudgingly found us a new room after what seemed like an hour of waiting. We then carried our own bags up to our room only to immediately be hit with a rancid smell of cigarette smoke as soon as we opened the door. I'm severely allergic to smoke and we ended up getting a refund and locating a much more accommodating and friendly hotel."
d_talbott_6.txt,"I recently stayed at The Talbott Hotel for 3 nights and I could not have been more disappointed. It was a terrible experience. Long wait to check into room since room wasn't ready even though I arrived way after the check in time. Front desk was very rude. Was given a smoking room when I had requested non-smoking. Room service left a lot to be desired. The food took forever to arrive and when it did it was cold and unappetizing. The staff at the hotel was not very helpful and was very unfriendly. Had no toilet paper in room. Room was very noisy. Could hear people next door opening doors, watching tv, talking. The room was very dingy, small and had a musty odor. Needless to say I will not be staying here again nor will I be recommending this hotel to anyone else. Stay away from this hotel. Not worth the money."
d_talbott_7.txt,"I'd expect a ""luxury"" hotel to pay more attention to details. The room really hadn't been thoroughly cleaned-- I found hairballs under the bed, the mirrors were streaked, etc. The desk staff took forever to even acknowledge me when I was checking in; three of them, two on the phone, and nobody even made eye contact for 5 minutes. Then, they gave the vaguest answers to some pretty basic questions about the neighborhood; you'd think they'd know where to find a Starbucks. The internet was ridiculously slow the whole two days I was there."
d_talbott_8.txt,"I selected The Talbott for my recent family vacation to Chicago. We chose the hotel for it's close proximity to Navy Pier and otherwise central location. In retrospect, the phrase ""location, location, location"" apparently does not apply to hotels. It's a good thing the location was so great, because just about everything that happened inside the hotel was bad. Upon our arrival, our room was not ready. The clerk could have been nicer about the whole situation, and told us simply that ""we would have to wait"" without offering any sort of help with our luggage or a timetable for when our room would be ready. When we finally arrived in the room, the sheets were not clean. A call to housekeeping proved difficult, as I do not speak Spanish. The second day of our trip, housekeeping never showed to clean the room despite the presence of our ""please service"" sign hung on the door. We stayed in for some room service after a long afternoon on Michigan Ave. When the food finally arrived a full hour after placing our order, it was cold and not very good. Despite these poor impressions, the management was unwilling to compromise on price at checkout. My call to corporate headquarters was answered by a call center in Mumbai. They will not receive my business again."
d_talbott_9.txt,"The Talbott Hotel claims to be Chicago's Premiere Small Luxury Hotel. After staying there and experiencing the service, environment, and the hotel in general, I can say with confidence that this just isn't true. I arrived with rather high expectations due to the claims made by the hotel and some of the reviews posted on their website and I was immediately disappointed. No one came to my car to collect my bags and I was forced to lug them inside myself. The doorman was polite but failed to even open the door for me, leaving me to fend for myself while trying to carry my bags. Once inside, the atmosphere was not what I expected. The lighting was poor, leaving the lobby dark and it looked like a dingy setting with a glossy veneer in an attempt to hide the degenerate state of the building. The carpet looked dirty, as if it hadn't been vacuumed or washed in quite some time, and up in the corners where the walls met the ceilings there was visible water damage. When I arrived at the front desk, I was forced to wait over five minutes until someone came out to help me. After checking in I went up to my room and was once again disappointed. The bed was very uncomfortable and I ran the shower for ten minutes without ever receiving any hot water. That night I ordered room service. The food took 45 minutes to get to my room, and when it finally arrived it was cold. The fitness center had a very small selection of machines which caused long lines while waiting to use them. I would certainly not recommend this hotel to any of my friends, and probably not to my enemies either. Stay away!"
t_affinia_1.txt,"We stayed 2 nights over spring break in what was called a Jr Suite but resembled a wide hallway with a window at one end. Bad cheap furniture, carpet that stops short of reaching the wall, a TV that sticks out into the middle of the room and a window that whistled when the wind blew. BAD BAD experience. Find aother hotel plenty in the area."
t_affinia_10.txt,"Stayed at the Fitzpatrick as a result of all of the glowing reviews on TripAdvisor and to avoid the normal corporate hotel. Good location but the room was dirty, and not just from the last housekeeping. It was dingy: a place where you needed the slippers they provided. And this was a suite. Also, the refrigerator was caked with ice and didn't work. Furthermore, because my travel agent had mixed up the dates I was to travel, I showed up a day late. The hotel said it wasn't a problem and that I wouldn't be charged for the no-show the night before. I had my travel desk verify this with the hotel management the same day. Then the Fitzpatrick charged me for both nights and refused to reverse the charges after many attempts to resolve. Neither I nor my corporate travel desk will use the Fitzpatrick again. Two dots only because it's in a good location and because the lobby was clean. I'm generally easy to please and slow to complain but this was bad."
t_affinia_11.txt,"We booked this hotel as a last minute vacation planned on doing a little shopping and nightlife downtown. We where woken up at 6:00 in the morning with our bathroom flooded, this water was brown and all the clothing and our belongings left in the bathroom were dirty and sopping wet. We where moved to another room, but it was smaller then the orginal room we had gotten and paid for. The next day the housekeeping service never even came to change our sheets, coffee or towels, which is just horrible service. The service along with the orginal room where perfect, but we do not plan on ever spending another weekend in that flooding hotel."
t_affinia_12.txt,"This hotel is a shambles-furniture literally falling apart and a staff that is both rude and uninformed, nevermind the lack of security and the absence of the so-called amenities. The ""fitness center"" is an oversized closet! We were appalled during our stay! Truly anticipated ""warm, Irish hospitality"" and short of a barman, no one was Irish, warm or hospitable! Manager was unresponsive to our needs and front desk attendent was incredibly rude when we made a simple request. Her manager (?) refused to come out of the office when she called to ask them to speak with us. Room was pretty at first glance but when dresser drawers fell out and the major construction of the hospital next door began at 7:30am it is not the kind of experience anyone could tolerate. To call this a Red Roof Inn would be an insult to RRI! The manager that finally called us back was soooo fake and insincere that we would have prefered no call at all. The only thing they have going for them is the location but its not worth the trade-off."
t_affinia_13.txt,"The hotel itself was beautiful and wonderful staff but the bottom line for me was that it was impossible to sleep through the night because the noise of the ambulance sirens continued throughout the night. For THREE consecutive nights. There was simply inadequate soundproofing - even 14 floors above the street (OK - 13 floors as there is no 13th floor). I hesitate to write this review but I rely on Trip Advisor reviews when traveling, and had I been warned about the ambulance sirens, I would have chosen to stay elsewhere. If you are a sound sleeper and noise is not an issue then it is a lovely hotel and excellent value. Conveniently located. Wonderful staff. But quiet is a key priority for me so I would not stay here again. :("
t_affinia_14.txt,"I'd been searching for a cool, non-chain hotel for a weekend getaway with my boyfriend. I thought I'd found a winner in the Affinia... SOO disappointed!! In spite of the fact that our reservation was for two adults, we arrived to find our room had a DOUBLE bed. What?! I was floored, but after a delayed flight and a 2 hour cab ride, was too tired to make a fuss. We were hungry after all the delays and planned on attending an event that night, so we called for room service hoping to keep it simple. I was told that room service would call ME back to take my order...and nothing happened. I didn't want to be late to our event so we ended up going to the restaurant downstairs. Nothing special; entree, dessert and NAB for two still came out to $*...I am no hayseed, I'm WELL aware that everything costs more in Chicago, but this just wasn't worth it. Our room was by the elevator w/ parking garage view...the bathroom was tiny, shower curtain was stained, funky toilet seat/lid, and the vanity featured that ""rude awakening"" lighting normally found in low-rent dressing rooms, i.e., ""Holy crap, have I looked that bad this whole time?!"" If you're a traveler who likes using the in-room coffeemaker, they charge for their chintzy coffees (I don't use these, but... come on). Nice enough ambience in the upstairs bar, but weak drinks... That night, our bed was so tiny and uncomfortable that I almost asked to switch rooms. But the Marathon was that weekend; the hotel was so busy I didn't want to be a pest. I can't believe I was so impressed with this place online. Next time I'll happily pay more to stay someplace that's actually a treat."
t_affinia_15.txt,"I stayed @ Affinia for one night on a purpose not to drive all the way from NW suburbs to Women's hospital oir my surgery. Few things I really didn't enjoy - I could hear noise from outside all night long as well as inside noise from slamming doors.No noise insulation at all! Very dusty between window frames(I understand - cars,pollution) but it looked like it wasn't cleaned for a very long time.One more thing really made me upset - broken blinds on a right side. I was unable to pull them down to enjoy my sleep time...We didn't notice the problem until very-very late.The Affinia hotel serving tourists and guests of Chicago as well as Northwestern Hospital patients and their families - which really need extra privacy and comfort ! Strange but every hotel I stayed @ was supplied with the SEALED roll of toilet paper.Affinia didn't even offer that.Looked like someone used a bathroom right after it was taking care of by a cleaning lady! Neither toilet paper nor toilet seat were sealed for us to use!!!!!!!!!!!! Hopefully,no more surgeries for me...Won't stay @ this place for leisure - even with discount!"
t_affinia_16.txt,"Having stayed at the excellent Affinia chain in NY, I had very high expectations. When I saw the Trip Advisor rating, I immediately booked. What a huge disappointment: -- The quality Simmons pillow top mattress is covered with very cheap, foam pillows -- the kind they sell in the store for $4. You cannot sleep on these -- The windows are so thin, you can hear the buzzing from walk/don't walk sign on Superior below. -- The walls are so thin that when my neighbor smoked, I was awaken around midnight, my room engulfed in smoke odor. A call downstairs yielded no results -- There are nice furnishings but many are chipped showing bare wood; the desk chair was full of loose threads -- The water flow is very weak, but the towels are nice -- There are unpainted floorboards, the kind you find in Day's Inn -- They charge for internet service The tiny lobby has materials and pictures of what the hotel will eventually look like. The sign outside is also a banner. Having stayed all over the U.S., you are better off at Red Roof -- this is really an embarassment for the Affinia chain. Wait until they complete the renovations in 2008. I did supply this feedback at my checkout and the front desk apologized by shaking my hand. Good heart, but the problems are not fixable."
t_affinia_17.txt,"I've been here for 4 days. Great location right off of miracle mile, near all major hotels, best shopping and theatres. Rooms very large. Hotel staff very friendly and helpful, and respond immediately. Problems: there frequently are homeless people (even during daylight) on Superior between St. Clair and Michigan Avenue (the main route you walk for or all activities, and just about everything is in walking distance from here). At night, the street on the north side of Superior is dark, and it usually smells strongly of several unpleasant odors. The street people do not approach you, although they may stare as you go by. Usually 2 or more along the way, where they sleep on the window sills of Neiman Marcus. I would not think a woman would feel safe by herself. (I am from a large city and do not have a street people phobia.) There are homeless up and down Michigan Street, but this is different as it's a lonely stretch and no open business is along either side of the street. The entire hotel needs a lot of cosmetic work, and apparently will soon undergo a major renovation. For now, expect two extremely small, warm, slow elevators with long waits serving 17 floors and warm, cramped hallways! All the walls throughout the hotel need painting, and the wallpaper is peeling in places. In the room, several electrical outlets were hanging out of the connection, the carpets were stained, the bathrooms needed new grout (some mold visible), the TV is very small (16 Inch?) and the windows very, very dirty. You won't get your room serviced unless you ask for it, sometimes more than once. The ""pub "" downstairs is run down, dark and kind of creepy. Food and room service are very expensive, as is parking ($34/day public and $38/day valet). On the plus side, the bed was very comfortable, there was ample comfortable furniture in the sitting area, plenty of space and a decent view as the hotels spans St. Clair street toward the north and south. You can see a sliver of Lake Michigan. Pool small, but clean. All in all, it was clean and quiet and provides lots of space for sitting around in the room, but I think it is overpriced, and I would not stay here again."
t_affinia_18.txt,"Stayed at the Fitzpatrick before, about 4 years ago, it was ok. The management was great, staff was so kind, and rooms were clean. ** But this time I promised my self NEVER to go back!! The new staff was so rude!! I made a reservation for my Anniversary on the internet, and the day of check in I was told by the hotel staff that they do not have my reservation!** 1) I was transferred around back and forth from the hotel staff to the reservations hotline. 2) Staff was extremely rude! Not arrogant, but rude! Like they hated thier job. 3) They offered check in at 1pm but the room wasn't ready till 3pm! 4) There were stains everywhere! 5) Because of the high sales of rooms due to popularity on this site, they must have hired a cheap unfriendly staff."
t_affinia_19.txt,"I'd been searching for a cool, non-chain hotel for a weekend getaway with my boyfriend. I thought I'd found a winner in the Affinia... SOO disappointed!! In spite of the fact that our reservation was for two adults, we arrived to find our room had a DOUBLE bed. What?! I was floored, but after a delayed flight and a 2 hour cab ride, was too tired to make a fuss. We were hungry after all the delays and planned on attending an event that night, so we called for room service hoping to keep it simple. I was told that room service would call ME back to take my order...and nothing happened. I didn't want to be late to our event so we ended up going to the restaurant downstairs. Nothing special; entree, dessert and NAB for two still came out to $*...I am no hayseed, I'm WELL aware that everything costs more in Chicago, but this just wasn't worth it. Our room was by the elevator w/ parking garage view...the bathroom was tiny, shower curtain was stained, funky toilet seat/lid, and the vanity featured that ""rude awakening"" lighting normally found in low-rent dressing rooms, i.e., ""Holy crap, have I looked that bad this whole time?!"" If you're a traveler who likes using the in-room coffeemaker, they charge for their chintzy coffees (I don't use these, but... come on). Nice enough ambience in the upstairs bar, but weak drinks... That night, our bed was so tiny and uncomfortable that I almost asked to switch rooms. But the Marathon was that weekend; the hotel was so busy I didn't want to be a pest. I can't believe I was so impressed with this place online. Next time I'll happily pay more to stay someplace that's actually a treat."
t_affinia_2.txt,"I wrote an email to the sales & reservation team a week ago.........i'm still waiting for a response. All I wanted to do was book a suite for 2 nights but they failed to even reply with an offer. We have now booked another hotel who can be bothered to answer emails. Shame you missed out, coz we tip like rockerfellers!!"
t_affinia_20.txt,"Apart from the location, great, but it stops there. Upon check-in, I was informed I would have a queen bed. I asked for a king size bed, and I was told there would be a charge for going up to a king. GIVE ME A BREAK, a surcharge for going from a queen to a king. When I got up to the room, it was like a oven. I could not get the air to work and needed to call twice before getting service. Everything in the room had a charge associated to it, even down to the coffee, $1.00. Now what's up with that? I was very disappointed in the size of the bathroom. Very small. I have stayed there twice and with so many other options, I feel this will be my last."
t_affinia_3.txt,"We were encouraged to stay at the Affinia as part of a group in town for a Chicago wedding. We booked our rooms 6 months in advance, with the promise of a brand-new, full service hotel in a great locaiton in Chicago. The lobby was non-existant (under construction). The front desk staff was incredibly rude and unhelpful. The hallways and elevators are small, cramped and uncomfortable. The rooms are great - great beds, great television set. NO ROOM SERVICE - the kitchen is under construction. The bottom line is that during our stay, this was NOT a full-service hotel and should not have charged what they did. We were totally disappointed, hope it will improve, but vow to never stay there and will recommend to anyone to check out one of Chicago's truly amazing hotels. It is not worth the risk with this unproven dress rehearsal."
t_affinia_4.txt,"me (taking a cue from david dancer): 'sup? front desk person: yes? me: so, do I have to wait in the elevator line to get up to my room? front desk person: what room are you in? me: **** front desk person: oh. ...i'm afraid so. OR, you can take the other elevators and take the fire stairs up to the 10th floor. me: oh? wtf! so, we're staying at this hotel, and there is a bar on the 29th floor, but we have to wait 15 minutes in line to get to our fucking hotel room? get bent! we're paying to stay here, not just drinking in your bar!"
t_affinia_5.txt,"I only stayed at this hotel for one night, the location was great but the elevators drove me crazy. After the first long wait I started to time how long it took from the moment I pushed the button until the elevator arrived, never under 10 min. even late at night. I went up to the rooftop for and after dinner drink with my husband... 1 margarita was $14! I wans't drinking because I'm pregnant so I had a soda water for $4... if I would have known I would have had tap water. Overall... great rooms, OK staff , horrible elevators, overpriced drinks."
t_affinia_6.txt,"I made reservations with the Chicago Fitzpatrick using their 800 number for two nights in June. I received no written confirmation with cancelation policy, etc. However, when I attempted to cancel my reservation the morning of my first night's reservation, I was told that they would charge me for one nights stay. They have a ""3pm THE DAY BEFORE your first nights stay"" policy. Even though the hotel was not sold out for the night they would not budge on the policy. This is not a common policy on Michigan Ave. I'd advise making your reservations someplace that offers more flexiblity for emergencies or sends a written confirmation with policy. It was a very expensive mistake on my part to book with this hotel!"
t_affinia_7.txt,"My husband and I stayed overnight at the Affinia. Prior reviews led us to believe this was a quality hotel; not true. Since it was a very special occasion, and also because we were only staying overnight, we didn't let the shabbiness and poor service of the hotel ruin our weekend. However, this would have qualified as one of the poorest hotel experiences. I've ever had. First, the smells: The linens and pillows on our bed smelled moldy and mildewy. The odors were not mild, and I found it pretty repulsive. I couldn't wait to jump out of bed in the morning, to get away from the odors. Hard to sleep and certainly didn't want to be in the bed any longer than absolutely necessary. I didn't discover how disgusting the bed smelled until around midnight when we got into bed. At that point, I chose not to contact housekeeping because (a) I was exhausted, and (b) I didn't want to upset my husband, who had fallen immediately to sleep after a long day of sightseeing. Also, the bathroom smelled like vinegar. Perhaps this is the cleaning agent used by Affinia, but the odor should have dissipated over the course of our stay and it never did. Incidentally, the bathroom floor tiles and wallpaper looked like they had seen better days; not a well-maintained property. Second, the elevators: If you stay above the first few floors, there are only two elevators that run from ground level to the rooftop c-view bar. With so many floors to service, and so many people going up to the c-view bar on a saturday, these elevators took forever to come, and were often full they did. Annoying. Also, on one occasion, there were several bottles (water and soda) left in the elevator; clearly, the maintenance crew doesn't inspect and clean the common areas frequently. Finally, and perhaps the most disappointing was the service when we arrived. First, when we booked, we asked for as quiet a room as possible. The hotel is located near Northwestern Memorial Hospital. But, its proximity to Michigan Ave., and the lack of accomodations elsewhere (due to the Transformers movie filming and a big international convention taking place the same week-end), led us to stay here anyway. At check-in, the clerk noted our request, and said our room was quiet room since it was not ""next to the elevators."" When we arrived at our room, we discovered that we were across from the elevators. Obviously, she was technically correct that we weren't next to the elevators, but it was still so close (15-20 feet) that we could hear the elevator noise. Also, since it was a special occasion, we asked if we could upgrade. The disingenuous, snarky, condescending clerk told us that checking in early was an upgrade. Clearly, the woman has not travelled enough to know that in many quality hotels, this is a matter of routine, not exception. Pretty awful experience all the way around. Other reviewers must have very low expectations. Can't explain any of the good reviews otherwise."
