t_homewood_17.txt,"I called the reservations line to book a room at the beginning of December 2012 for a rate with a local corporation. When I first made the reservation I did not get an e-mail confirmation. I had to call again to get the e-mail and then saw that I was booked in a handicapped accessible room which i did not need as there was me, my wife and three year old. I called the reservation line and asked for a regular room which they said was impossible at the rate I was at, however for ten dollars more I can upgrade to a regular room. I then asked what if a disabled person needs the room and he said he could not help me. i told them to cancel the room. based on the reservation experience, I did not want to run into anymore trouble at this hotel."
t_homewood_18.txt,"I choose the Homewood Suites in Downtown Chicago because I called them directly in search of a two bed room within walking distances of the attractions of Chicago. Well, when we arrived, it was apparent that there was chaos do to one of two elevators being out of service (which it had been since Tuesday, this was Saturday). Once we finally got to the 6th floor to check in, I figured our relaxing time had begun. Well, we got our room key and headed for the17th floor. Again, waited for an elevator but finally made it two our room. I put the key in the door it opened to the surprise of me and the family already inside the room - Yup we got double booked. The family was very nice and seemed OK with their surprise visitors. Said our apologies and went back to the elevator and waited again to head back down to the 6th floor registration to figure the mess out. We have now been at the hotel for a half hour with no room and slightly annoyed. Made it to the reservation desk and explained the situation. I did get an apology and a new room. New key in hand waited AGAIN for an elevator to bring us to the 9th floor for a new room. FINALLY got to our room only to find it was a king suite. We are a family of four including two full grown teenage boys. There was no way they were going to fit on a pull out sofa. So, REALLY annoyed now, I called the front desk and was told that were no rooms with two beds left even though I had specifically asked for two beds when I booked. It said two beds on preference on my reservation but the reservation agent assured me two beds would be available when I checked in. She went so far to but TWO BEDS on my reservation paper work. The operator said there are is only one two bed room on each floor. The only thing we got was a fold up bed that took away half the room in the living area. Now, I paid a total of 349.00 for one night for this room. We got the mess mentioned above and a breakfast out of the deal. I am pretty sure my next trip to Chicago will not include this hotel. I can tell you that we are frequent HWS/Hilton customers but this hotel will not be on our list of stops in the future."
t_homewood_19.txt,"This review has two parts. . .I advise reading both. Chapter One: The actual hotel and staff I found the in house staff to be very friendly and accommodating. The room was nice and clean as well. I have no disagreement with any of the other reviews regarding the hotel room or the staff. This is a great location where you can walk three blocks to to the South to reach the riverfront, or a few blocks to reach the water tower to the North. Very easy (one block) walk from the subway (Red line). The morning complimentary breakfast is substantial. Not just muffins and coffee. You can have a complete breakfast here if you want. And, even the breakfast servers were really nice and efficient. I would recommend this hotel IF based solely on the physical location, the room, and the staff. Chapter Two: The nightmare I booked this room through central reservations in July for a mid-September arrival. The rate was quoted to me as $159 per night for four nights. When the confirmation was emailed to me, it was incorrect by over $300. I immediately called the hotel. They said they made the correction and emailed a new confirmation with the correct amount. I did receive the corrected confirmation email. . .All done? NO. One week later, my credit card statement arrives with the old higher amount having been charged. I called the hotel and was transferred to central reservations to resolve. When I explained the error, I was literally called a liar by the person in reservations, and told ""That's not my problem. I can't help you"". . . and then told that I have to pay the higher amount. Excuse ME? Now, I go back to calling the hotel manager to get some assistance. After a few left messages, I get the general manager to call me back, and discuss the issue. After taking down all of the names of people I spoke with, he assures me that he will credit the account immediately. I even get a call from someone in his accounting dept to confirm my credit card etc. . . One week later, still no credit. So, I call the general manager again. Oh, this might take up to 72 hours to process, I am told. So, please give it another week. Another week passes, still no credit. So another call to the manager. I am told now that the credit HAS been processed, and he even sends me an email confirming our ""agreement"" for the credit, just to appease me. Another week passes. Still, not seeing that credit that was ""definitely processed"" a week ago. Yet another call to the general manager on the day before I am to leave on my trip to Chicago. I told him I will be arriving, and at this point, I want to see him personally, and he can physically use my credit card to process the credit while I am there. Remember, we are now talking SIX WEEKS and this is still not resolved. I arrive at the hotel, and to make a long story short, the general manager was NEVER available to see me, nor did he make any attempts to schedule any time to see or talk with me. The only person I spoke face to face with, was the assistant general manager. He was completely unconcerned with my situation, and made the completely inappropriate statement to me of ""you realize this boils down to a matter of 'he said she said'"". . . WHAT???? Today, my trip is over, and I have flown back home. I STILL HAVE NOT RECEIVED THE CREDIT TO MY ACCOUNT!!! I will absolutely be reporting all of this to Hilton Corporate Customer Service, and will absolutely be disputing the entire amount at this point. Take this little adventure into consideration when dealing with this hotel."
t_homewood_2.txt,"While it was a nice hotel, but i am rather frustrated with them! During our stay our room was cleaned twice by housekeeping. The first day was fine. Second day my diamond earrings came up missing. Noticed they were missing while in the packing up and checking out process. My biggest mistake was not staying there and dealing with this further. But we had a family reunion and funeral to get to. While the front desk was great and said they would handle it, I believe they say these things just to get you to go on about your way! We filed a police report and the GM of the hotel is supposed to be working on it. We have called several times but receive no answers. They keep telling us the cleaning staff have been there 10 + years.....that dosen't matter to me! If they are not held accountable what's to stop them from taking anything. There is a dishwasher in the room, and they found my daughters ring (which was in the same glass with my diamond earrings) in the dishwasher. They say I put the cup in the dishwasher. First, I am on vacation, trust me i'm NOT doing dishes! Second, why would I wash one glass and leave the other dirty dishes in the room? So, while it is a nice hotel....lock up your things of value! They may come up ""missing"" and you'll be left frustrated!!"
t_homewood_20.txt,"I called on December 6th, 2010 at 3 p.m. to book a room for an upcoming weekend getaway, and was taken aback when the phone was picked up and promptly hung up without a word. Thinking this might have been a simple mistake, I gave it another try. A woman introducing herself as ""Toni"" answered the phone, rushed through her introduction, sounding incredibly bored and annoyed that she had to answer the phone. Barely letting a second go by after her introduction, she gave a snotty ""Hello?!"" before I could open my mouth and tell her ""Never mind."" Never has a hotel answered my call so rudely. I'd like to give the hotel the benefit of the doubt and pin this unpleasant experience to ""Toni""; however I will not be calling back again in hopes to stay at this hotel during this trip."
t_homewood_3.txt,"The lobby of the Homewood is right down the hall from the kitchen and dining room(actually more of a grade school cafeteria type set up). The odors from the kitchen were disgusting, and indeed reminded my of that of a institutional kitchen(I.e. hospital). The free breakfast and free dinner were not at all palatable. I suppose that if you are traveling with a young family as many guests were, that makes this hotel a good value. But i would not stay here again."
t_homewood_4.txt,"I booked this hotel for my family of 4 to stay overnight to see the Magnificent Mile Christmas Lights Parade. I chose it because it had a sofa sleeper and one bed. We arrived at our hotel around 3:30 PM to check in. We came at this time because the front desk worker said that we could not check in until 3:00 PM. After giving him our name, the manager said,""OK, we have your king smoking suite available"". We quickly corrected him to let him know that we were traveling with two very young kids and we reserved a non-smoking room. He insisted that his computer said that we reserved a smoking room. We went back and forth, then he asked us if we had a copy of our reservation. Luckily, we were able to pull the reservation up on our phone. It clearly said non-smoking. After showing him our reservation, he explained that there was nothing that he could do to correct the situation because they had no other rooms available. So why in the world did he need to see our reservation!! We decided to see if we could handle the smoking room. It turns out that the entire floor was smoking and for a non smoker there was no way that we could sleep in a smoking room on a smoking floor with our two young children. The manager eventually called around and found a hampton inn near by with one bed. We canceled our room reservation. We live about an hour away from downtown so we made the late night trip back home. My family was very disappointed. My husband is a gold member with Hilton. Let's just say we will be switching back to Marriott. The hotel lobby was dated. The smoking room that I saw looked very dated as well. They made an error and never owned up to it, nor did they do anything to compensate us for such a huge inconvenience."
t_homewood_5.txt,"I booked this hotel on Priceline for 4/13, and a week later called the hotel directly to add 4/12 to our stay. The receptionist confirmed my reservation confirmation# and gave me a lower rate for both nights for the same king suite. When we arrived at check-in, there was no record of my 4/12 reservation whatsoever. The hotel was also fully booked, leaving my tired, hungry family and I high and dry with nowhere to go. The only decent thing that happened with this whole debacle was that Lisa at the check-in desk called around to several other hotels close-by to find us a room, and seemed to be the only employee working at a very busy time of evening. We ended up at Embassy Suites for both nights and had a very pleasant experience there."
t_homewood_6.txt,"We planned to stay for 5 nights on a family trip. I booked this hotel because of the expected value for a suite as well as the free breakfast - get a quick bite, then head out for the day to do normal tourist stuff. Well, our stay here lasted 1 night and we quickly, and thankfully, switched to a different hotel for our last 4 nights. The room was dirty. When we opened the sofabed, the sheets were filthy and there was a mess of dirt and crumbs that fell out. Ridiculous considering this is a suite hotel where the sofabeds are likely used, and theoretically cleaned, a lot. Extra blankets were also dirty and bathrooms weren't much better. Temperature control in the room was imprecise - minor inconvenience but without clean blankets on our only night, it made for a cold stay. If you like to eat for free (they have free breakfasts and dinner on certain nights) and don't care to eat the great food Chicago has to offer, I guess some may find this place tolerable. But we found the buffet no better than average and felt like we were at a Golden Corral. The only thing this hotel really has going for it is location but there are other options in this area (we switched to The James and had a great experience). I couldn't be paid to stay here again. I'm shocked by the high overall rating given our experience."
t_homewood_7.txt,"After reading good reviews about I booked a 5 night stay. Checked in late bit called early in the day to assure we'd have a roll away as well as the pull out sofa for 2 teens. They somehow had us booked for two rooms instead. Got that sorted out and arrived around 10 pm. Checked in and waited for our luggage... Finally went down and got it ourselves. The room was a little grungy, furniture shabby, and discovered a suspicious stain on the duvet cover. Ewww. Called for a new duvet cover which was delivered and unceremoniously handed to me. FYI it's kinda gross to have to change the duvet cover in a hotel. Next day tried to iron a dress for dinner and the iron didn't work. Called for a replacement, waited a while, called again and was brought another iron which also didn't work. Third time was a charm. Oh boy. Too bad we paid in advance. Won't be staying here again."
t_homewood_8.txt,"This hotel had a great location, but you can do much better for the money. The hallways smelled of smoke, dirty elevators, furniture in the lobby was thread bare. The staff was very helpful. The room was large, bed comfortable but the room was so musty and old smoke lingered. If you have any allergies don't stay here!"
t_homewood_9.txt,"We went to Chicago for my 2nd wedding anniversary and stayed at Homewood. My first impression was great, very helpful valet employees and VERY nice. That is one perk of my stay here. Otherwise, we had no problems checking in other than the hotel has 19 floors and when we booked the room we asked that we have the highest room avalible due to the fact that it was my husband first time there and the higher up, the more beautiful the view is. So we got the 9th floor. Not what I call ""high up"" when the rooms started on floor 6. Then the following morning, we went to breakfast of which was ok, nothing great. My husband and I went down in jeans and a sweatshirt but had not really thought about shoes as we thought it would just be a few bagles, some fruit, and that was it. So, we got our food and sat down. After getting stared at for the first 15-20 minutes, an employee came and told us that we wernt allowed to eat breakfast without our shoes on. Remind you, it was about 15-20 minutes after we had even entered the room. So she asked that we go get shoes while sitting down and eating our breakfast. Pretty pointless AFTER we already had gotten our food. I am sure it is because very few employees could speak understandable english that it took so long. Last but not least, dont come with a clean car. I had washed my car one day prior to arriving there and when it was returned, it was filthy dirty."
t_hyatt_1.txt,"Our trip was our annual anniversary trip. The hotel did not honor my choice of king size bed. Instead we received two double beds. This seriously decreased our enjoyment of our stay at the Hyatt. There were two cups of coffee complimentary in the room. No complimentary coffee anyplace else in the very large hotel. Location was more of a business district, not appropriate for pleasure trip. Employees of Hyatt were very friendly and helpful, other than the failure to deliver the reserved room."
t_hyatt_10.txt,"The room was dingy and run down - it felt like staying in a cheap motel. The carpet was exceptionally worn, wallpaper peeling, bathroom grout dingy. The place felt like it hadn't been redecorated in 30 years. On top of that, the windows would not open (not unusual for a hig-rise hotel), and there was no air fan for ac or heat - how the temp control was supposed to work, I have no idea (they said 'radient cooling' whatever that is), but we had to call down to the front desk and ask for a floor fan to cool the room and have some air circulation. We even went so far as to prop the door open and put the fan in the fan in the door while we were in the room to not feel suffocated. So much for privacy. I can't comment on the food, because we ate out at every chance. Chicago has some fantastic food! And much of it within easy distance to the hotel. The hotel is in a good location, near the waterfront and millenium park, shopping and dining. The conference facilities were average, but frustrating because they were in the basement and cell phone reception was non-existent. I will never stay in this hotel again, especially for the price, because of the poor room quality."
t_hyatt_11.txt,"First let me say, I try not to be too critical, but in some cases the truth is warranted! We checked in and things seemed fine. Location was excellent. Woke up the first morning, to a slightly rumpled bed covered in ""stains"", I hope-filthy and not 4 star hotel quality. Requested a linen change and heard a knock on the door- a gentleman was there to let me know if I wanted it done to take off the privacy sign, I did and no one even came until later in the day. The room was big enough, had no drawers, suposedly remodeled but carpet didn't reach the wall, toilet paper holder fell off constantly and shower head was broken. The mirrors were great and the water was always hot! The walls were paper thin, I heard every conversation the guests next door had. They were not noisy but you could hear everything including the t.v. through the walls and vents. Internet was $13.00, worked for a bit and then not again, I called customer service and spent 25 minutes on the phone and they asked if they could work on resetting the system and call back later. The hotel did give us a credit for the charges. At this point, enough was enough, we packed our bags and checked out. The front desk was very helpful- kudos to Rocco for caring and being the only friendly staff we saw other than the bell hops!!"
t_hyatt_12.txt,"My expectations were not high because I booked this hotel through priceline for $58 / night. An amazing deal if not for the fact that you had to wait 15 - 20 minutes for hot water. I called the front desk to tell them that there was no hot water - to which they nonchalantly replied: ""try running it for 15 to 20 minutes."" They forgot to tell me to keep the water running after my shower, if anyone else expected to use the shower. My boyfriend, who showered after me, had to wait another 10 minutes to get the shower warm again. To make matters worse, after room service was delivered, we called and said we needed another fork. They told us it would cost $3 ($1 for the fork, $2 for delivey charge). Absolutely ridiculous!! At least with a 1 star hotel, you get hot water. This is supposed to be a 4 star hotel. I guess you do get what you paid for - I just feel bad for the people who actually paid full price."
t_hyatt_13.txt,"Thank god I got this hotel through priceline. I can't imagine paying full price for this place. The tub was moldy and dingy. The toilet didn't flush. Their selection of TV channels was limited to say the least. Unless you wanted to pay $5 for a rerun of an NBC show. Oh, and internet? Why that will set you back about $15 for the day. And breakfast? That's about $16 for a cup of coffee, a croissant and two slices of honeydew. This hotel is the pits. The customer service is....absent! When you walk in to the ridiculous lobby (decked out like some bad late 80's prom) there's no one to direct you upstairs to the check in. And once you're there, check in is very fast, i'll grant them that. This hotel is a big, crummy rip-off. I will never stay here (and will steer clear of Hyatts in general I believe)."
t_hyatt_14.txt,"The lines at the check in desk were tremendously long so we decided to use the computerized self check in. The only option the self check in gave us was the size of the bed. When we got to our room, we immediately realized we were placed in a smoking room but we were unable or perhaps the staff was unwilling to move us to a non smoking room. I am allergic to the smoke and that made my stay uncomfortable. The walls seemed thin and we could clearly hear the conversations of the guests in the rooms next to us. When we went to breakfast, we were seated quickly but it was nearly ten minutes before our server arrived. For the price they were charging, the wait was unacceptable and we went elsewhere. It also took ten extra minutes than promised for the valet to get our car. For forty dollars a day for parking, we expected better."
t_hyatt_15.txt,"The Chicago Hyatt Regency deceptively alters the cancellation policy by charging the full room rate upon cancellation--ie the room cannot be cancelled. I recently booked over the phone a one night stay directly with the hotel. The reservation specialist mentioned over the phone there was a 72-hour cancellation policy. However, when I tried to cancel the reservation within that timeframe, Robert, the reservation supervisor, said that the room could not be cancelled at any time without charging full price for the room. He said that I should refer to the confirmation e-mail that states at the bottom that prepayment is required at time of booking / non-refunable. This clearly was not what was agreed to over the phone. I told him to cancel without being charged. In response, he threatened to cancel and charge me for the full stay. Why would someone cancel if they are going to be charged full price? The bottom line is the hotel deceptively changed the terms of the agreement, and Robert should go back to customer service school!"
t_hyatt_16.txt,"staff was very courteous. desk clerk gave only one coupon for the free breakfast instead of two. second desk clerk gave the wrong time for the breakfast on the second day, causing us to miss the free period. room was very clean, with a nice view of the river. bed was very comfortable. toilet looked like it belonged in a public restroom (no tank; instead it had a stainless steel valve) instead of a 4-star hotel. no dresser to store clothes. no wastebasket in the room, and there was a cover for the icebucket, but no icebucket. folding luggage stand had a broken strap. location was good, close to the river. several american-style eating places nearby. overall, a disappointment for a four-star hotel. i expected more for a hyatt regency."
t_hyatt_17.txt,"They allowed parties to go on all night and booked us in a room with no running water. We called security twice for them to do nothing about the party. When they finally came up about 30 people filed out of that room only to file right back in after about 10 minutes. When we called back nothing was done about it. My 2 year old son was awaken by all the loud music and cursing. THEN we get up the next morning at 7:30 to get ready only to find that we have no running water. After the maintenance man piddles around with it for a half hour we have no time to shower and have to ride the two hour train ride dirty and tired from no sleep. They did not resolve this issue. They just keep passing my complaint to ""managers"" supposedly. It was the worst stay of my life and my poor two year old had to be there for it"
