d_intercontinental_15.txt,"I was on a business trip to Chicago a while back and I had the unfortunate luck of staying at the InterContinental Chicago Hotel. I say unfortunate , because from the first moment I walked in my experience was poor. The front desk made me wait a very long time and I had to resolve an issue with my reservation. My receptionist had made the reservation and the room should have already been on or company account but they were insisting that I supply a personal credit card for the room. I understand their precautions but I travel a lot and usually do not encounter this situation. Once that was all taken care of (several phone calls later) I was taken up to my room. It was nice and I was glad to finally be there, but the bell hope was very short with me and was very quick to throw out his hand asking for a tip, even though he had done nothing but groaned the entire time he was taking me to my room. I was very happy I only had to stay there two night because after my run in with the front desk I got the impression that no one wanted to deal with me. I will hopefully not be staying there again, and will suggest that it be avoided by all."
d_intercontinental_16.txt,"I recently had a horrible stay at the InterContinental Hotel in Chicago. When I first arrived I was impressed with the architecture and location, but things went downhill in a hurry. The front desk staff was extremely rude upon checking in and even though I had reserved a room with two queen beds, they told me that ""only king bed rooms were available at the time"", and there was nothing they could do about it. The room itself was a nightmare. It smelled like an ashtray and it was very clear that the bedding was in dire need of replacement. There was also a huge problem with my television, in that it would automatically turn itself off every 15 minutes or so. I complained about these problems, but very little was done. The hotel staff eventually did bring me new sheets, but the quality was only marginally improved. Overall I was very disappointed with my stay at the InterContinental Hotel in Chicago. From the pictures I had seen online I had expected a wonderful hotel, but what I actually got was on par with what you would typically find at a rundown interstate motel."
d_intercontinental_17.txt,"This hotel has a good name and a good location in Chicago. Unfortunately I was very unsatisfied with this hotel. This is a luxury hotel, so you are paying luxury prices. So, I expect to get my money's worth. Unfortunately that was not the case at the InterContinental. Firstly, my room was surprisingly small and unclean and could probably use a renovation and an upgrade in the furniture. Again, this is supposed to be a luxury hotel, and it's expensive. I shouldn't be worried about why the carpet and other parts of the room seem dirty. I also had trouble getting the room to the temperature I wanted. I'm not sure if there was just a problem with the air condition in my room or if it's a problem in the whole hotel. The building is old and I suppose it has a lot of problems from being old. Secondly, I was disappointed with the quality of the service from the hotel's staff. I thought they were somewhat rude and inattentive. Thirdly, this hotel has a lot of additional expenses. I felt like they wanted to overcharge me every chance they got (use of the fitness amenities, internet, etc). When I'm already paying so much for a hotel room, I get very irritated when I feel I'm being nickel-and-dimed every chance they get. This hotel has a nice looking building, and again, it's in a terrific location. But I really don't think it's worth the expense. There are so many other hotels in Chicago to choose from that are so much better."
d_intercontinental_18.txt,"I've never written a review before, but I just had to share my experience with Chicago's InterContinental Hotel. I booked a weekend at this hotel for my wife's birthday. We've never stayed at a luxury hotel before and I thought this would be a great experience for us. The horrors started when we first got to the counter. The clerk mixed up our rooms and when I pointed this out he got really snooty with me. We get to our room and the maid hadn't cleaned it yet! We had to wait around for that, so we went to the hotel's restaurant and the food was terrible and overpriced. Finally our room is finished and the the ""view"" we were promised was non-existent. To top it off the maid did a terrible job cleaning. The toilet was dirty and we actually found a stain. A stain! on the sheets. What a waste of money. I pointed this out the concierge and we weren't even offered a refund or discount. Never again."
d_intercontinental_19.txt,"This hotel was very poor with customer service. They were so worried about keeping everything up to date and perfect looking in the hotel they rarely worried about their customers, and their guests. I had to ask for my room to be serviced for cleaning, and it took a long time to get a response. Very disappointed."
d_intercontinental_2.txt,"My husband and I stayed at this hotel the weekend of Sept. 17-18, 2011. When we were planning our vacation, we were impressed with the hotel. The exterior is very lovely and we looked forward to enjoying the view from our room. We first started to wonder if we'd made the right choice when there was no one waiting to help us with our bags. We had to carry our luggage up to our room ourselves as the hotel was in the middle of a shift change. This seems like something a supposedly ""world class"" hotel should be able to avoid. The good: Our room did have a nice view and when I sat down on the bed it was like sitting on a cloud. The shower was very pleasant. The bad: The room was very small and the bed was not the King size we had requested. We felt very cramped and uncomfortable throughout our stay. We have stayed at less luxurious hotels that were much more spacious and able to provide us with the requested size bed. The restaurant options were acceptable, although the service was not as excellent as described. Perhaps we expected a miracle that would've changed our minds about the hotel. We were so disappointed by the room and the service at check-in the rest of the weekend was somewhat tainted. We usually enjoy partaking of room service, but we decided after a sub par first day we would eat out for the rest of the weekend. Next time, we will look into other hotels in the Chicago area."
d_intercontinental_20.txt,"The InterContinental Chicago hotel terrible. First of all, the continental breakfast was a joke. The food was unhealthy and unsatisfactory. After our first night, we expected the maid to come clean up our room. We came back from site-seeing to find that our room was in the same condition we left it in. I will never go back to this hotel again."
d_intercontinental_3.txt,"The International Chicago Magnificent Mile is shrouded in glamour, but underneath the facade fades away. The ""classical architectural landmark"" should be translated to ""old and boring. I found this hotel via Google and have regretted it ever since. Room size was small and unaccommodating, and that was one of the newer rooms! Everything was free except for the gym (why that wouldn't be free with the price I paid I don't know). This hotel is overpriced for the quality and size of the room that you get, and I would not recommend staying there."
d_intercontinental_4.txt,"My family and I were in Chicago for a friend's wedding. We had asked around to find a hotel that was nice, but affordable and were pointed in the direction of the InterContinental Chicago hotel. The hotel appeared very nice, and to have all the amenities: Room service, WiFi, clean rooms. Unfortunately, as it turned out, appearances can be deceiving. It begins at the desk, where the clerk was downright rude and uncaring. He said they didn't have any rooms available because we didn't make arrangements. It was getting late, and we had no place to go, there weren't any hotels nearby and my kids were starving. I asked if there was anything he could do, and he said that I will have to ask someone else because he was busy. I talked with his manager and after a bit of fussing, the manager apologized and moved us into a room for the night. Apparently, our expectations for what would be the normal amenities for a hotel stay was above standard, because this room wasn't even clean and the wifi didn't work. We ordered room service, and it never came, even after several complaints. It doesn't end there either; when we got home we found that the hotel had charged us for the room service. Overall, this was a very frustrating experience, and I wouldn't stay there again."
d_intercontinental_5.txt,"My wife and I were excited to visit and shop at Chicago's Magnificent Mile on Michigan Ave. We chose the Intercontinental Hotel for it's reputation and location. Man oh man, were we disappointed. The check in was smooth enough even though the hotel was busy and all seemed well. We got ready to go out shopping and went to visit the concierge in the lobby to ask about suggestions and bargains. There were six people in line for her and we had to wait. That was no problem since we weren't on a timetable. When we finally got to her and asked about shopping on the Miracle Mile, she just pointed to the door and said, ""It's right out the door."" I asked her for suggestions of the best stores for bargains and she rolled her eyes at me saying, ""there's no such thing."" I couldn't believe her abruptness. We left the concierge stand not wanting to return. Shopping went well and was fun. We returned to our room and wanted to look up a restaurant for the night ourselves rather than ask the concierge. We couldn't find a hotel directory in the room. I called the Housekeeping Department and was told, ""we're all out of directories here in the office."" I asked if they could check a vacant room for one. She said the hotel was full and there were no vacant rooms. I hung up and thought I would just look for a restaurant in the yellow pages. Guess what? You guessed it, no phone book in the room. I figured we could go get a drink at The Bar, the hotel's 20's themed lounge, and ask the bartender for suggestions. We went to The Bar and there were only three other customers. We sat at the bar and got our drinks. As I was about to ask the bartender for restaurant suggestions, his cell phone rang. He answered it and went to the other end of the bar to talk. Twenty minutes later, he was still on the phone. Tired and hungry, my wife and I went back to our room and ordered a pizza to be delivered from Pizza Hut. Although the hotel is nice enough and the furnishings comfortable, the indifference of the staff will keep me from ever coming back. A big thumbs down to the Intercontinental Chicago. They need to look up the word hospitality in the dictionary."
d_intercontinental_6.txt,"Problems started when I booked the InterContinental Chicago online at the hotel's site, and got a server error. Somehow I managed to get my reservation, and wish I had looked elsewhere on this great Chicago street, filled with plenty of other options. The server errors continued at check in and didn't let up. I was on a holiday weekend, but far too many others must have been pushy conventioneers, and I had trouble getting served. The hotel is enormous and doesn't give a sense of comfort. The health facilities are also just too big, so noisy and crowded. And Internet access was $18 a day, kind of surprising when I can go around the corner to a Starbucks! Next time, I'll pick a more intimate place nearby--without so many ""server errors""."
d_intercontinental_7.txt,"Although the InterContinental Chicago Hotel is located on ""The Magnificent Mile,"" our entire experience as guests there was anything but ....believe me, the ""magnificence"" ends at the hotel entrance! From check-in to check-out, our impressions ranged from lackluster to horrific. First, there was an error with our reservation, and once we got to our room, we found that neither our phone nor our internet connection worked, so down I trudged to the registration desk--where I had to wait in line for at least twenty minutes--to ask for help. The first night we spent was nearly totally sleepless due to TV noise coming from the next room; we weren't sure whether it was due to excessively inconsiderate neighbors or thin walls. Then, dog tired the next morning--even though we had hung a ""Do Not Disturb"" sign on our door handle--in barged the maid all bright-eyed and bushy tailed with scrubber in hand. Following that rude awakening, I was jarred again by a blood-curdling shriek from my wife, who, upon entering the bathroom to take her shower, was greeted by an incredibly large roach! Breakfast--actually all meals of which we partook at the hotel--were served cold and were somewhat tasteless. We were routinely ignored by the concierge, who always seems to be on a personal call whenever we needed him. Trying to leave the hotel was equally as difficult as checking in. Of course, there was a gross error in our bill which caused us to be delayed in our effort to depart. Getting out of the InterContinental Chicago was, believe me, the best part of our experience as guests there."
d_intercontinental_8.txt,"Recently stayed at the InterContinental Chicago Magnificent Mile and was a little underwhelmed. It's convenient location did not compensate for the fact that the property is very old and definitely in need of some updating and renovating. There is a definite need for some noise control -- everything and everybody could be heard from inside the room. Hearing the plumbing from other guests' rooms was particularly annoying. The fitness facilities are really hyped but unfortunately they were not free to use (at least it wasn't included with my booking choice). Parking was pretty expensive so if you really don't need it, don't use it. Overall, just dissappointed that the great location wasn't matched with great accommodations."
d_intercontinental_9.txt,"I only stayed here for five days, but I will definitely never be going back. The architecture is kind of cool, but the customer service was very poor. I don't know how much these people get paid, but they must not think it is enough. Breakfast at the The Continental was alright, but it was overpriced. This hotel felt really crowded and the service was impersonal. There are many better places to stay in Chicago."
d_james_1.txt,"When I went to The James hotel in Chicago I truly expected a luxury experience exactly like what they were advertising. Gorgeous chairs, staff at the desk focusing on their job, and a clean, well decorated hotel room. Much to my, and my wallet's dismay I found quite the opposite. I arrived to the hotel late after my flight was delayed, and found the clerk reading a magazine. It must have been a fascinating article, as it took him a full minute to look up and ask if I had a reservation, or would be making one. I said I had one, and gave him the voucher I'd printed out. He checked it, and said that all the single rooms had already been rented out, he went on to say that I would have to pay extra for a two or three person room if I wished to stay the night. I grudgingly accepted the two person option as the jet lag was setting in and I desperately needed to get some sleep. The clerk offered to walk me to my room, saying I looked tired and trying to navigate the hotel would be much easier after I got some sleep. I accepted, and followed him to my new room. He carried the briefcase I had with me, but it was not apparent why at the time as I had both hands free. He ushered me into my room, setting the briefcase down inside, and said if I needed anything that the phone next to the bed would give me a direct line to room service without having to dial anything. I thanked him and closed the door. It was then that I looked around and fully saw where I was staying. What was supposedly a two person suite was two twin beds 6"" apart, covered in ruffled blankets and sheets. The cleaning staff had obviously not been in here recently. A quick look around the other areas and I found the bathroom was out of toilet paper and soap, not even the complementary ones were left behind. I got ready for bed, and looked around for the TV remote, which it turned out, had no batteries in it. Instead, I just turned out the lights and rolled over, sheets and blanket turned inside out to try and find a cleaner option. In the morning I walked down to the lobby and asked to check out. I'd had enough of the hotel after one night. The clerk that morning was a cheerful blond who cheerfully asked me my room number and handed me a bill. $240 for my room, and an extra $80 with a note about a baggage service. I asked her about it, and she said if anyone carried my bags to my room for me it was filed under the baggage service. I asked if it was considered reasonable to charge $80 for carrying a suitcase to a room two floors up, and riding the elevator, and she said it was unusual, but not unheard of. She offered to change it to a ""mere"" $20 and handed me a slip with a phone number, name, and reason for the disagreement, saying that the manager would handle any complaints between the clerk and I after I signed it. I did so, and left, my wallet $260 lighter, and my head throbbing with a headache from lack of sleep."
d_james_10.txt,"I recently stayed in The James Hotel in Chicago and trust me I will never do it again. When you pay a premium price you'd expect first rate service. Our whole experience was a disaster though short lived b/c we could stay their another second. When we arrived at the hotel we had to wait while the receptionist finished playing with her phone for service and then our room was not ready. So we had to wait in the lobby with our baggage. When we finally got to the room I wouldn't exactly call it clean but it wasn't to bad. The pictures on the website are nice enough but the furniture is falling apart and probably from Walmart. There was plenty of space for an average person of 5' but I'm 6'4"" and the beds where smaller than what they said, not to mention uncomfortable. We ordered room service and not only did they bring us the wrong order but it took 2 hours. There walls were also paper thin so we got little sleep. The heater helped block out some noise until it stopped working in the middle of the night. So the next morning, sore from the uncomfortable bed, hungry tired and cold we checked out before we even had our coffee. Stay away!"
d_james_11.txt,"I was disappointed in my stay at The James. I am on a strict gluten free diet and was told the hotel restaurant could accomodate my needs. Each time I sat down for a meal, I would explain my dietary needs to the waiter. Most times, I ended up having to send the plate back because some gluten item was included. My wife has sleep apnea and when we made our reservations, I made sure to ask if there was a room available with an outlet near the bed so that she could plug in her CPAP machine. I was assured that this was no problem. However, when we arrived at the hotel, we had to request a room change because there was no outlet near the bed. We had to wait in the lobby for sometime because the room we were moved to was not yet finished benig cleaned. Overall, it was not an entirely horrific stay, but I expected more out of a hotel of this supposed caliber. Next time I visit Chicago, I will be staying at another hotel."
d_james_12.txt,"I was initially excited when I found out that my employer was sending me to Chicago on business, but I could never have imagined the frustration and irritation that would be heaped on me by the inept staff of The James Chicago. When I arrived, my reservation could not be found in their system, although I had made it myself. After some words with the manager on duty, Mr. Chad Montgomery, I was given a room at the previously agreed upon rate. Anyone can make a mistake, so I wasn't too angry at that point. My room was bland and colorless, in spite of The James' boasts of their attention to design and detail. The room was mostly clean, but after seeing the stains on the bedding, I am not convinced that they were washed after the room's last occupant. I attended a stressful business meeting in The Dining Room that night, complete with cold and undercooked food served by sloppy, disgruntled waitstaff. Afterward I decided that a relaxing spa treatment was in order. I was assured that I would enjoy ""Asha's Purifying Shower Ritual"", which would primarily take place in my own room. The shower was okay, but I think I must be allergic to the jojoba oil provided, because I broke out in hives all over my body. Next came the ""in-room"" portion. While I was in the shower, five of the foulest smelling candles had been lit in my room. I guess they were supposed to make it smell good, but I began choking on the odor the minute I walked in the room. My masseuse directed me to lie on the bed for the next portion, but his hands wandered a little too much for my liking. I am sure certain areas are NOT on the massage menu. In closing, if you have ever considered staying at The James Chicago, I beg of you to reconsider. With only a handful of positive things to say about the hotel, and a suitcase full of negative (including a pending court case against the masseuse), I can almost guarantee you would regret staying there. I know I do."
d_james_13.txt,"James Chicago would be one of the worst hotels I have ever been to in my life! Even though i noticed that the design of the place was extremely artistic, its service quality and hotel conditions were horrible. They gave me a room in which the blankets were dirty and looked as if it been used just moments ago! I figured it was because the hotel was busy but I started to notice that the furniture came with a cost in service. The television was not working at all. I was extremely disapointed, especially when coming from a rigorous day of work and just wanting to relax. Sadly, i settled in doing my work instead of frittering my time doing noting when i got the next disapointment. The Wifi was a bust. Absolutely nothing to do but to stare at the furniture or just stare at the wall. I am never going to James Hotel ever again!"
d_james_14.txt,"James Chicago; the luxurious nice hotel as it was advertised. I didn't want stay in this hotel, but my wife insisted. Ok, so when I booked the ticket, it cost me $299 for one room. $299! I could get a new honeycomb android tablet with dual core processor at that price point! The room was stylish though, it looked nice. There was a TV, and the beds were fine. Although I couldn't quite understand why they had Wifi and no computer. Why would I even need wifi if there is no computer? What were they thinking!? The experience I had with James Chicago was a bit below of what I had expected. I mean the food available there wasn't very tasty at all. I had to wait in a long line to get the ticket and I was also hoping to browse the internet, but they had no computer, only wifi. That's like only having bread, without any fillings to make it into a sandwich!"
d_james_15.txt,DO NOT STAY HERE!! My wife and I were visiting family in Chicago and decided to stay at the James. We had stayed at the James in New York happily so we came in with good expectations. What a mistake. Our room looked nothing like the ones pictured on the website. The bathroom was dirty and the bedding and furniture were disheveled. There was also a musty odor to the room. When we called the front desk to complain they were quite rude. We ended up leaving and staying in a different hotel for the duration of our stay.
d_james_16.txt,"A recent stay at the James Hotel-Chicago, revealed the the recent updating at this hotel was a facelift only. Although the rooms and public areas look nice, the hotel still needs serious work. Our first room was not clean when we arrived and this non-smoking room had a serious odor of cigarette smoke. We asked for a new room which was clean and odor free. We had to involve the Manager before our request was granted. The new room was better at first glance, but was severely lacking. We could not get the temperature properly regulated. The room was always either too hot or too cold for our two night stay. In a hotel commanding the rates of the James, we expect the room temperature to be a comfort which is taken for granted, not something which is a constant battle. Our mattress was horribly uncomfortable. When the rooms were updated, the James skipped new mattresses. Ours was worn to the point of having indentations you can't get out of--when you lie down, you sort of sink into a hole. This matter of basic comfort should not be an issue in a 'luxury' hotel. Last, but not least, we found the hotel to be loud at almost all times during our stay. In spite of the calming decor, the noise level was raucous and not at all conducive to a good night's sleep. All in all, we were unhappy with our accommodations at the James Chicago and would recommend you avoid the hotel even though it is in a convenient location. You will be happier almost anywhere else."
d_james_17.txt,"The hotel was not one of the better ones I stayed at. the room was seemingly nice at first, but after staying there for a few days it seemed like the cleaning staff never came through to clean it. I had the same sheets for a three days before I called and requested they be changed. Also, the walls seem to be paper thin and you can hear what is going on in the adjacent rooms, which interfered with my sleep. I ate at the primehouse in the restaurant also, and asked for a well done steak, and the steak was still pretty pink on the inside and lacked flavor. This is definitely not a hotel I would recommend to anyone."
